{
  "contract_definition_hash": "42b4b24623173e6cf862c4f2626042810f5662a137c871d9150847b652007560",
  "contracts": [
    {
      "blocking_level": "blocking",
      "current_status": "not_run",
      "global_contract_id": null,
      "implementation_only": true,
      "implementation_reason": "current-four 文件、hash、图幅和 process phase 是当前 P0 数据与验收编排。",
      "owner": "P0 harness",
      "p0_contract_id": "P0-ACC-001",
      "related_global_contract_ids": [
        "PDF-001",
        "PDF-003",
        "PRJ-001"
      ],
      "stable_p0_requirement": "四份 PDF 均可上传并完成 processing；A3/A4 与 1/2 页事实匹配 frozen manifest",
      "task_id": "D7-T2",
      "tier": "live-e2e",
      "verification_selector": "phase://live/process?input_set=current-four"
    },
    {
      "blocking_level": "blocking",
      "current_status": "not_run",
      "global_contract_id": null,
      "implementation_only": true,
      "implementation_reason": "current-four candidate/coverage和operator-confirmed item-set completeness是当前P0验收编排。",
      "owner": "P0 harness",
      "p0_contract_id": "P0-ACC-002",
      "related_global_contract_ids": [
        "CAND-005",
        "REV-002"
      ],
      "stable_p0_requirement": "四份均产生带source/coordinates/disposition的可审核candidates；质量人员逐页确认应检验项均keep/add且excluded有明确disposition evidence，空结果、coverage blocking或mass exclusion不得冒充ready",
      "task_id": "D7-T2",
      "tier": "live-e2e",
      "verification_selector": "phase://live/candidates?input_set=current-four"
    },
    {
      "blocking_level": "blocking",
      "current_status": "not_run",
      "global_contract_id": null,
      "implementation_only": true,
      "implementation_reason": "current-four 必做的具体 review command 组合是当前试用验收编排。",
      "owner": "P0 harness",
      "p0_contract_id": "P0-ACC-003",
      "related_global_contract_ids": [
        "REV-004",
        "REV-006"
      ],
      "stable_p0_requirement": "四份均可完成至少一次 keep/exclude/edit/add/confirmation，并在适用样例执行 merge 或 split",
      "task_id": "D7-T2",
      "tier": "live-e2e",
      "verification_selector": "phase://live/review?input_set=current-four"
    },
    {
      "blocking_level": "blocking",
      "current_status": "not_run",
      "global_contract_id": null,
      "implementation_only": true,
      "implementation_reason": "current-four browser balloon操作、可见性和零hard-collision是当前试用验收编排。",
      "owner": "P0 harness",
      "p0_contract_id": "P0-ACC-004",
      "related_global_contract_ids": [
        "BAL-006",
        "BAL-007"
      ],
      "stable_p0_requirement": "四份的每个active balloon-required item均有一个可见可读正式气泡；完成drag、delete/rebuild、explicit renumber后hard collision和unresolved manual-required均为0",
      "task_id": "D7-T2",
      "tier": "browser-live-e2e",
      "verification_selector": "phase://live/balloons?input_set=current-four"
    },
    {
      "blocking_level": "blocking",
      "current_status": "not_run",
      "global_contract_id": null,
      "implementation_only": true,
      "implementation_reason": "current-four同页export和三产物下载phase是当前P0数据与验收编排。",
      "owner": "P0 harness",
      "p0_contract_id": "P0-ACC-005",
      "related_global_contract_ids": [
        "EXP-004",
        "EXP-005",
        "EXP-006"
      ],
      "stable_p0_requirement": "operator从同一Product Design工作台触发正式export；仅原子成功后每份样例显示恰好ballooned PDF、fixed SIP Excel和manifest三个下载",
      "task_id": "D7-T2",
      "tier": "live-e2e",
      "verification_selector": "phase://live/export?input_set=current-four"
    },
    {
      "blocking_level": "blocking",
      "current_status": "not_run",
      "global_contract_id": null,
      "implementation_only": true,
      "implementation_reason": "current-four UI与cross-artifact consistency phase是当前P0验收编排。",
      "owner": "P0 harness",
      "p0_contract_id": "P0-ACC-006",
      "related_global_contract_ids": [
        "EXP-005",
        "EXP-007"
      ],
      "stable_p0_requirement": "四份的工作台检验项表、reviewed items、balloons、PDF、Excel和manifest使用一致item identity、count与正式编号",
      "task_id": "D7-T2",
      "tier": "live-e2e",
      "verification_selector": "phase://live/consistency?input_set=current-four"
    },
    {
      "blocking_level": "fatal",
      "current_status": "not_run",
      "global_contract_id": "PRJ-005",
      "implementation_only": false,
      "implementation_reason": "—",
      "owner": "Processing / Export formal-success Veto Gate",
      "p0_contract_id": "P0-ACC-007",
      "related_global_contract_ids": [
        "EXP-006"
      ],
      "stable_p0_requirement": "Provider、storage、template、font 或任一子产物故障都不会产生 formal success/download",
      "task_id": "D7-T1",
      "tier": "failure-e2e",
      "verification_selector": "phase://failure/no-silent-success"
    },
    {
      "blocking_level": "blocking",
      "current_status": "passed",
      "global_contract_id": "BAL-002",
      "implementation_only": false,
      "implementation_reason": "—",
      "owner": "Numbering Owner",
      "p0_contract_id": "P0-BAL-001",
      "related_global_contract_ids": [],
      "stable_p0_requirement": "working copy 产生稳定、连续但非正式的 suggested numbers",
      "task_id": "D5-T1",
      "tier": "unit",
      "verification_selector": "pytest backend/tests/unit/balloons/test_numbering.py::test_suggested_numbers_are_stable_and_contiguous -q"
    },
    {
      "blocking_level": "blocking",
      "current_status": "passed",
      "global_contract_id": "BAL-002",
      "implementation_only": false,
      "implementation_reason": "—",
      "owner": "Numbering Owner",
      "p0_contract_id": "P0-BAL-002",
      "related_global_contract_ids": [],
      "stable_p0_requirement": "formal numbers 只能在 reviewed item set freeze 后、`reviewed_result` 创建前生成",
      "task_id": "D5-T2",
      "tier": "integration",
      "verification_selector": "pytest backend/tests/integration/test_balloon_service.py::test_formal_numbers_require_frozen_item_set -q"
    },
    {
      "blocking_level": "blocking",
      "current_status": "passed",
      "global_contract_id": "BAL-003",
      "implementation_only": false,
      "implementation_reason": "—",
      "owner": "Numbering Owner",
      "p0_contract_id": "P0-BAL-003",
      "related_global_contract_ids": [],
      "stable_p0_requirement": "默认正式编号从 1 开始",
      "task_id": "D5-T1",
      "tier": "unit",
      "verification_selector": "pytest backend/tests/unit/balloons/test_numbering.py::test_default_start_is_one -q"
    },
    {
      "blocking_level": "blocking",
      "current_status": "passed",
      "global_contract_id": "BAL-003",
      "implementation_only": false,
      "implementation_reason": "—",
      "owner": "Numbering Owner",
      "p0_contract_id": "P0-BAL-004",
      "related_global_contract_ids": [],
      "stable_p0_requirement": "正式编号唯一、连续、不留缺号",
      "task_id": "D5-T1",
      "tier": "unit",
      "verification_selector": "pytest backend/tests/unit/balloons/test_numbering.py::test_formal_sequence_has_no_gap_or_duplicate -q"
    },
    {
      "blocking_level": "blocking",
      "current_status": "passed",
      "global_contract_id": "BAL-003",
      "implementation_only": false,
      "implementation_reason": "—",
      "owner": "Numbering Owner",
      "p0_contract_id": "P0-BAL-005",
      "related_global_contract_ids": [],
      "stable_p0_requirement": "`balloon_required=false` 的通用要求不占编号",
      "task_id": "D5-T1",
      "tier": "unit",
      "verification_selector": "pytest backend/tests/unit/balloons/test_numbering.py::test_general_requirements_do_not_consume_numbers -q"
    },
    {
      "blocking_level": "blocking",
      "current_status": "not_run",
      "global_contract_id": "BAL-004",
      "implementation_only": false,
      "implementation_reason": "—",
      "owner": "Placement Owner",
      "p0_contract_id": "P0-BAL-006",
      "related_global_contract_ids": [],
      "stable_p0_requirement": "placement按稳定正式编号顺序搜索有限八方向与多距离候选；同输入确定性一致，不同气泡无circle/circle、glyph/glyph或glyph/other-circle hard overlap，自身编号完整位于所属圆内",
      "task_id": "D7-T2",
      "tier": "unit",
      "verification_selector": "pytest backend/tests/unit/balloons/test_collision_layout.py::test_batch_layout_has_no_balloon_or_number_overlap -q"
    },
    {
      "blocking_level": "blocking",
      "current_status": "not_run",
      "global_contract_id": "BAL-004",
      "implementation_only": false,
      "implementation_reason": "—",
      "owner": "Placement Owner",
      "p0_contract_id": "P0-BAL-007",
      "related_global_contract_ids": [],
      "stable_p0_requirement": "所有合法候选耗尽时返回 `manual_required`、best attempt、完整hard collision flags和reason，不伪装为placed",
      "task_id": "D7-T2",
      "tier": "unit",
      "verification_selector": "pytest backend/tests/unit/balloons/test_collision_layout.py::test_exhausted_legal_positions_require_manual_resolution -q"
    },
    {
      "blocking_level": "blocking",
      "current_status": "passed",
      "global_contract_id": "BAL-005",
      "implementation_only": false,
      "implementation_reason": "—",
      "owner": "Balloon command service",
      "p0_contract_id": "P0-BAL-008",
      "related_global_contract_ids": [],
      "stable_p0_requirement": "operator 可拖动并以 PDF 坐标保存 balloon center；frontend viewport 坐标不落库",
      "task_id": "D5-T2",
      "tier": "integration",
      "verification_selector": "pytest backend/tests/integration/test_balloon_operations.py::test_move_persists_pdf_coordinates -q"
    },
    {
      "blocking_level": "blocking",
      "current_status": "passed",
      "global_contract_id": "BAL-006",
      "implementation_only": false,
      "implementation_reason": "—",
      "owner": "Balloon command service",
      "p0_contract_id": "P0-BAL-009",
      "related_global_contract_ids": [],
      "stable_p0_requirement": "删除 balloon 不删除 inspection item，也不静默改变 `balloon_required`",
      "task_id": "D5-T2",
      "tier": "integration",
      "verification_selector": "pytest backend/tests/integration/test_balloon_operations.py::test_delete_balloon_preserves_item_and_requirement -q"
    },
    {